{
  "id": "GBScultoriViergeCroissant",
  "QID_wikidata": "",
  "title": "",
  "creator": [
    {
      "xml_id": "GiovanniBattistaScultori",
      "role": "graveur"
    }
  ],
  "entry_type": "artwork",
  "materialsAndTechniques": "",
  "dateCreated": {
    "startYear": null,
    "endYear": null,
    "text": ""
  },
  "location": {
    "type": "multiple_locations"
  },
  "related_works": [],
  "bibliography": [
    {
      "zotero_key": "straussIllustratedBartsch311986",
      "location": "n° 4 (378)"
    }
  ],
  "illustrations": [],
  "description": "",
  "commentary": "",
  "history": [
    {
      "date": "2026-03-06T14:48:18.473860",
      "type": "created",
      "author": "Pierre"
    }
  ],
  "complete_entry": false
}