{
  "id": "RaimondiNeptune",
  "QID_wikidata": "",
  "title": "Neptune",
  "creator": [
    {
      "xml_id": "MarcantonioRaimondi",
      "role": "graveur"
    }
  ],
  "entry_type": "artwork",
  "materialsAndTechniques": "burin",
  "dateCreated": {
    "startYear": null,
    "endYear": null,
    "text": ""
  },
  "location": {
    "type": "multiple_locations"
  },
  "related_works": [],
  "bibliography": [
    {
      "zotero_key": "straussIllustratedBartsch271978",
      "location": "n° 352 (264)"
    }
  ],
  "illustrations": [],
  "description": "",
  "commentary": "",
  "history": [
    {
      "date": "2026-03-06T14:48:18.466200",
      "type": "created",
      "author": "Pierre"
    }
  ],
  "complete_entry": false
}