{
  "id": "VenezianoPsyche",
  "QID_wikidata": "",
  "title": "Histoire de Psyché (3 planches)",
  "creator": [
    {
      "xml_id": "AgostinoVeneziano",
      "role": "graveur"
    }
  ],
  "entry_type": "artwork",
  "materialsAndTechniques": "burin",
  "dateCreated": {
    "startYear": null,
    "endYear": null,
    "text": ""
  },
  "location": {
    "type": "multiple_locations"
  },
  "related_works": [],
  "bibliography": [
    {
      "zotero_key": "straussIllustratedBartsch261978",
      "location": "n° 236 (190)"
    }
  ],
  "illustrations": [],
  "description": "",
  "commentary": "",
  "history": [
    {
      "date": "2026-03-06T14:48:18.471497",
      "type": "created",
      "author": "Pierre"
    }
  ],
  "complete_entry": false
}